{
  "$schema": "../../schemas/runtime-verdict.schema.json",
  "screenId": "NurtureSession",
  "runId": "nurture-session-canonical-2026-04-11",
  "status": "pass",
  "residuals": [],
  "promoteable": true,
  "factoryLearnings": [
    "2026-04-11 created minimal ui-spec skeleton for phase block header and graduation tags strip",
    "runtime capture connected to capture-ui-screens.js"
  ],
  "latestStage": "runtimeCapture",
  "captureArtifacts": {
    "screenshotPath": "artifacts/ui-qa/manual/nurture-session-canonical-2026-04-11/NurtureSession.png",
    "captureReportPath": "artifacts/ui-qa/manual/nurture-session-canonical-2026-04-11/capture-report.json"
  },
  "diagnosticsSummary": {
    "consoleErrorCount": 0,
    "consoleWarningCount": 0,
    "pageErrorCount": 0,
    "requestFailureCount": 0
  },
  "history": [
    {
      "runId": null,
      "status": "not-run",
      "updatedAt": "2026-04-11T00:00:00Z",
      "residualCount": 1,
      "promoteable": false
    },
    {
      "runId": "runtime-smoke-r1",
      "status": "pass-with-minor-residuals",
      "updatedAt": "2026-04-11T11:58:52.273Z",
      "residualCount": 1,
      "promoteable": true
    },
    {
      "runId": "runtime-smoke-r2",
      "status": "pass-with-minor-residuals",
      "updatedAt": "2026-04-11T11:59:57.340Z",
      "residualCount": 1,
      "promoteable": true
    },
    {
      "runId": "runtime-smoke-r3",
      "status": "pass",
      "updatedAt": "2026-04-11T12:03:21.190Z",
      "residualCount": 0,
      "promoteable": true
    },
    {
      "runId": "runtime-smoke-r4",
      "status": "pass",
      "updatedAt": "2026-04-11T12:03:24.544Z",
      "residualCount": 0,
      "promoteable": true
    },
    {
      "runId": "nurture-session-canonical-2026-04-11",
      "status": "pass",
      "updatedAt": "2026-04-11T13:07:45.696Z",
      "residualCount": 0,
      "promoteable": true
    }
  ],
  "updatedAt": "2026-04-11T13:07:45.696Z"
}
