{
  "$schema": "../../schemas/runtime-verdict.schema.json",
  "screenId": "GachaMain",
  "runId": "UI-2-0023",
  "status": "pass-with-minor-residuals",
  "residuals": [
    "console warnings: 2"
  ],
  "promoteable": true,
  "factoryLearnings": [
    "runtime capture connected to capture-ui-screens.js"
  ],
  "latestStage": "runtimeCapture",
  "captureArtifacts": {
    "screenshotPath": "artifacts/ui-qa/UI-2-0023/Gacha.png",
    "captureReportPath": "artifacts/ui-qa/gacha-main/runtime-triage-r4/capture-report.json"
  },
  "diagnosticsSummary": {
    "consoleErrorCount": 0,
    "consoleWarningCount": 2,
    "pageErrorCount": 0,
    "requestFailureCount": 0
  },
  "history": [
    {
      "runId": null,
      "status": "not-run",
      "updatedAt": "2026-04-08T05:06:05.996Z",
      "residualCount": 0,
      "promoteable": false
    },
    {
      "runId": "runtime-onboarding-r2",
      "status": "pass-with-minor-residuals",
      "updatedAt": "2026-04-08T05:06:13.433Z",
      "residualCount": 1,
      "promoteable": true
    },
    {
      "runId": "runtime-triage-r3",
      "status": "pass",
      "updatedAt": "2026-04-08T05:22:41.509Z",
      "residualCount": 0,
      "promoteable": true
    },
    {
      "runId": "runtime-triage-r4",
      "status": "pass",
      "updatedAt": "2026-04-08T05:35:46.838Z",
      "residualCount": 0,
      "promoteable": true
    },
    {
      "runId": "UI-2-0023",
      "status": "pass",
      "updatedAt": "2026-04-08T09:23:08.550Z",
      "residualCount": 0,
      "promoteable": true
    },
    {
      "runId": "UI-2-0023",
      "status": "pass-with-minor-residuals",
      "updatedAt": "2026-04-14T04:12:19.644Z",
      "residualCount": 1,
      "promoteable": true
    }
  ],
  "updatedAt": "2026-04-14T04:12:19.644Z"
}
