{
  "$schema": "../../schemas/runtime-verdict.schema.json",
  "screenId": "ShopMain",
  "runId": "UI-2-0023",
  "status": "pass",
  "residuals": [],
  "promoteable": true,
  "factoryLearnings": [
    "runtime capture connected to capture-ui-screens.js"
  ],
  "latestStage": "runtimeCapture",
  "captureArtifacts": {
    "screenshotPath": "artifacts/ui-qa/UI-2-0023/ShopMain.png",
    "captureReportPath": "artifacts/ui-qa/shop-main/runtime-triage-r3/capture-report.json"
  },
  "diagnosticsSummary": {
    "consoleErrorCount": 0,
    "consoleWarningCount": 0,
    "pageErrorCount": 0,
    "requestFailureCount": 0
  },
  "history": [
    {
      "runId": "runtime-gate-f-r1",
      "status": "pass-with-minor-residuals",
      "updatedAt": "2026-04-08T03:55:36.441Z",
      "residualCount": 1,
      "promoteable": true
    },
    {
      "runId": "runtime-gate-f-r2",
      "status": "pass-with-minor-residuals",
      "updatedAt": "2026-04-08T03:56:08.103Z",
      "residualCount": 1,
      "promoteable": true
    },
    {
      "runId": "runtime-triage-r3",
      "status": "pass",
      "updatedAt": "2026-04-08T04:45:47.927Z",
      "residualCount": 0,
      "promoteable": true
    },
    {
      "runId": "UI-2-0023",
      "status": "pass",
      "updatedAt": "2026-04-08T09:23:03.674Z",
      "residualCount": 0,
      "promoteable": true
    }
  ],
  "updatedAt": "2026-04-08T09:23:03.674Z"
}
