{
  "$schema": "../../schemas/runtime-verdict.schema.json",
  "screenId": "SpiritTallyDetail",
  "runId": "runtime-onboarding-r2",
  "status": "pass",
  "residuals": [],
  "promoteable": true,
  "factoryLearnings": [
    "runtime capture connected to capture-ui-screens.js"
  ],
  "latestStage": "runtimeCapture",
  "captureArtifacts": {
    "screenshotPath": "artifacts/ui-qa/spirit-tally-detail/runtime-onboarding-r2/SpiritTallyDetail.png",
    "captureReportPath": "artifacts/ui-qa/spirit-tally-detail/runtime-onboarding-r2/capture-report.json"
  },
  "diagnosticsSummary": {
    "consoleErrorCount": 0,
    "consoleWarningCount": 0,
    "pageErrorCount": 0,
    "requestFailureCount": 0
  },
  "history": [
    {
      "runId": null,
      "status": "not-run",
      "updatedAt": "2026-04-08T04:52:37.268Z",
      "residualCount": 0,
      "promoteable": false
    },
    {
      "runId": "runtime-onboarding-r2",
      "status": "pass",
      "updatedAt": "2026-04-08T04:52:44.127Z",
      "residualCount": 0,
      "promoteable": true
    }
  ],
  "updatedAt": "2026-04-08T04:52:44.127Z"
}
